Transaction Date (value),Originating Currency,Originating Amount,Debit Credit Indicator,Beneficiary Bank Raw,Originator Bank Raw,Originator Account Number,Beneficiary Account Number,Originator Name,Beneficiary Name,Subject Type,Transaction Type Source,Transaction Code Description,Sending Bank Account Number,Sending Bank Address,Converted Amount,Fraud Payment 
2025-01-02,HKD,10000,C,,,222-222222-101,111-111111-101,CHEUNG TAK SHING,CHAN TAI MAN,Beneficiary,CUTF,Default transaction,,,10000,1
2025-01-02,HKD,10000,D,,,222-222222-101,111-111111-101,,CHAN TAI MAN,Originator,DUTF,Default transaction,,,10000,1
2025-01-03,HKD,2200,C,,,,111-111111-101,,CHAN TAI MAN,Beneficiary,CCCS,CASH DEP VIA CDM/BCDM -  AC INPUT (TOUCH SCREEN),,,2200,2
2025-01-03,HKD,10000,C,,,,111-111111-101,,CHAN TAI MAN,Beneficiary,CCCS,CASH DEP VIA CDM/BCDM -  AC INPUT (TOUCH SCREEN),,,10000,3
2025-01-03,HKD,30000,C,,,222-222222-102,111-111111-101,YAN MEI MEI,CHAN TAI MAN,Beneficiary,CUTF,ATM TRANSFER UNRELATED   DEPOSIT,,,30000,4
2025-01-03,HKD,30000,D,,,222-222222-102,111-111111-101,,CHAN TAI MAN,Originator,DUTF,ATM TRANSFER UNRELATED   WITHDRAWAL,,,30000,4
2025-01-03,HKD,42000,C,,,222-222222-102,111-111111-101,YAN MEI MEI,CHAN TAI MAN,Beneficiary,CUTF,DCP UNRELATED ELECTRONIC TRANSFER CREDIT FROM PIB,,,42000,5
2025-01-03,HKD,42000,D,,,222-222222-102,111-111111-101,,CHAN TAI MAN,Originator,DUTF,DCP UNRELATED ELECTRONIC TRANSFER DEBIT FROM PIB,,,42000,5
